{"algorithm":"hmac-sha256","divergence":{"class":"none","halted":false,"indicators":[]},"evidence_items_consumed":[],"key_id":"proof-key","lineage_chain":[],"reconstructed_state_hash":"sha256:a6d069d659f4d44821f92dd13e27fe744a3363d7613d790a58100f30c263d369","replay_finished_at":"2026-04-03T21:12:08Z","replay_started_at":"2026-04-03T21:12:08Z","signature":"sha256:d8195169b6b514870f82906409b5a687d4f69e3d5b541927cd2dc9712838a193"}
