{"algorithm":"hmac-sha256","divergence":{"class":"none","halted":false,"indicators":[]},"evidence_items_consumed":[],"key_id":"proof-key","lineage_chain":[],"reconstructed_state_hash":"sha256:4596c4e414d6edcd7e5681514eb9674f9dbf25d0153def22dbc772f32e7c01d5","replay_finished_at":"2026-04-04T14:26:17Z","replay_started_at":"2026-04-04T14:26:17Z","signature":"sha256:fff4d9cf2ce88404e5e1b7931133dd2613b06bd2f980f636212ff3fe49ccca45"}
