{"algorithm":"hmac-sha256","divergence":{"class":"state_divergence","halted":true,"indicators":["result_divergence"]},"evidence_items_consumed":["epoch-1"],"key_id":"proof-key","lineage_chain":[{"baseline_source":"","decision":"diverge","digest_match":false,"epoch_id":"epoch-1","passed":false,"replay_score":0.0,"trusted":false}],"reconstructed_state_hash":"sha256:35a95c25dfc6a8e6a46f55b7e5ca37270ae869bae062d54a7271656f4aa781f6","replay_finished_at":"2026-04-04T14:26:17Z","replay_started_at":"2026-04-04T14:26:17Z","signature":"sha256:e5d6a89bf0c4143876280b6b6b573ec107ff35bb443e7fa4b0839950f38667f9"}
