{"algorithm":"hmac-sha256","divergence":{"class":"state_divergence","halted":false,"indicators":["result_divergence"]},"evidence_items_consumed":[],"key_id":"proof-key","lineage_chain":[{"baseline_source":"","decision":"diverge","digest_match":false,"epoch_id":"","passed":false,"replay_score":0.0,"trusted":false}],"reconstructed_state_hash":"sha256:12f4400f8fb3e8ed49576520c042f21465e44153cd871b11dddfdeb68ede554a","replay_finished_at":"2026-04-04T14:26:13Z","replay_started_at":"2026-04-04T14:26:13Z","signature":"sha256:e32f52d9901cc6c7f9bdd911ee8e2c848574822a6652964748ee7c11c26d2736"}
