{"algorithm":"hmac-sha256","divergence":{"class":"state_divergence","halted":true,"indicators":["result_divergence"]},"evidence_items_consumed":[],"key_id":"proof-key","lineage_chain":[{"baseline_source":"","decision":"diverge","digest_match":false,"epoch_id":"","passed":false,"replay_score":0.0,"trusted":false}],"reconstructed_state_hash":"sha256:688b772a5222cb24d35c87e40bd89aebb04913a90bcb3d50794e0bde0b792fa1","replay_finished_at":"2026-04-04T14:26:15Z","replay_started_at":"2026-04-04T14:26:15Z","signature":"sha256:0c2ed32aece99e7eace262771afb044c2c77a5cd2d7bbadd8c6129865b2b8eea"}
